{
  "$schema": "https://json-schema.org/draft/2020-12/schema",
  "$id": "https://aigengame.dev/panda-adventure/data/schema/combat_config.schema.json",
  "title": "Panda Adventure combat configuration",
  "description": "Authoritative config for S2 Laser Gun combat (gADR-0000: JSON is the single source of truth). Converted by scripts/build_config.py into three derived Resources: data/generated/stats_player.tres and stats_enemy.tres (StatsConfig stat blocks — the same shape for attacker and defender, gADR-0001) and data/generated/combat_config.tres (CombatConfig: damage-formula params, i-frame window, and the Projectile color/motion/juice). The projectile_size box migrated OUT to scale_spec.json (gADR-0013), composed back in by the builder; the legacy S2 static-enemy block (enemy_color/enemy_size/enemy_position, superseded by per-kind wave spawning since S4) was deleted with it.",
  "type": "object",
  "additionalProperties": false,
  "required": [
    "player_stats",
    "enemy_stats",
    "attack_scale",
    "defense_scale",
    "min_damage",
    "iframe_duration",
    "projectile_color",
    "projectile_speed",
    "projectile_lifetime",
    "projectile_spawn_offset",
    "hit_flash_color",
    "hit_flash_duration"
  ],
  "$defs": {
    "stat_block": {
      "description": "A per-actor-kind stat block (StatsConfig). Player and Enemy share this shape — the symmetric attacker/defender contract of the damage formula.",
      "type": "object",
      "additionalProperties": false,
      "required": ["max_hp", "max_mp", "attack", "defense"],
      "properties": {
        "max_hp": {
          "description": "Maximum (and starting) HP; strictly positive.",
          "type": "number",
          "exclusiveMinimum": 0.0
        },
        "max_mp": {
          "description": "Maximum (and starting) MP; non-negative (MP is spent only by the Gravity Gun, S3).",
          "type": "number",
          "minimum": 0.0
        },
        "attack": {
          "description": "Attack stat fed to the damage formula when this actor is the attacker; non-negative.",
          "type": "number",
          "minimum": 0.0
        },
        "defense": {
          "description": "Defense/mitigation stat fed to the damage formula when this actor is the defender; non-negative. 0 until the Spacesuit exists.",
          "type": "number",
          "minimum": 0.0
        }
      }
    }
  },
  "properties": {
    "player_stats": { "$ref": "#/$defs/stat_block" },
    "enemy_stats": { "$ref": "#/$defs/stat_block" },
    "attack_scale": {
      "description": "Damage-formula multiplier on the attacker's attack; strictly positive.",
      "type": "number",
      "exclusiveMinimum": 0.0
    },
    "defense_scale": {
      "description": "Damage-formula multiplier on the defender's defense; non-negative.",
      "type": "number",
      "minimum": 0.0
    },
    "min_damage": {
      "description": "Damage floor — a landed hit never deals less than this; non-negative.",
      "type": "number",
      "minimum": 0.0
    },
    "iframe_duration": {
      "description": "Seconds of invulnerability a defender gets after a landed hit (i-frames); strictly positive.",
      "type": "number",
      "exclusiveMinimum": 0.0
    },
    "projectile_color": {
      "description": "Projectile block color as RGBA, each component in 0..1.",
      "type": "array",
      "items": { "type": "number", "minimum": 0.0, "maximum": 1.0 },
      "minItems": 4,
      "maxItems": 4
    },
    "projectile_asset": {
      "description": "Optional view asset reference for the Laser Gun bolt block (P2-S2, #436): a res:// path or asset-pipeline id the view seam resolves; absent (or empty) renders the colored-block fallback. Authored empty until an asset slice fills it (asset references are data, gADR-0000).",
      "type": "string",
      "pattern": "^[^\"\\\\]*$"
    },
    "projectile_speed": {
      "description": "Projectile travel speed in px/s; strictly positive.",
      "type": "number",
      "exclusiveMinimum": 0.0
    },
    "projectile_lifetime": {
      "description": "Seconds before an unhit projectile despawns; strictly positive.",
      "type": "number",
      "exclusiveMinimum": 0.0
    },
    "projectile_spawn_offset": {
      "description": "Projectile spawn offset (x, y) in pixels from the Player origin; x is scaled by facing.",
      "type": "array",
      "items": { "type": "number" },
      "minItems": 2,
      "maxItems": 2
    },
    "hit_flash_color": {
      "description": "Enemy block modulate at the moment of a landed hit — the flash the tween recovers from; RGBA in 0..1.",
      "type": "array",
      "items": { "type": "number", "minimum": 0.0, "maximum": 1.0 },
      "minItems": 4,
      "maxItems": 4
    },
    "hit_flash_duration": {
      "description": "Seconds for the hit flash to recover to normal modulate; strictly positive.",
      "type": "number",
      "exclusiveMinimum": 0.0
    }
  }
}
